{"$schema":"https://json-schema.org/draft/2020-12/schema","$id":"https://novel-production-os.local/schemas/soft-corpus.labels.v1.schema.json","type":"object","additionalProperties":false,"required":["schema_version","samples_hash","labels","labels_hash"],"properties":{"schema_version":{"const":"soft-corpus.labels.v1"},"samples_hash":{"$ref":"#/$defs/hash"},"labels":{"type":"array","minItems":90,"maxItems":90,"items":{"type":"object","additionalProperties":false,"required":["sample_id","expected_detected"],"properties":{"sample_id":{"type":"string"},"expected_detected":{"type":"boolean"}}}},"labels_hash":{"$ref":"#/$defs/hash"}},"$defs":{"hash":{"type":"string","pattern":"^sha256:[0-9a-f]{64}$"}}}