{"labels":[{"expected_detected":true,"sample_id":"soft_persona_drift_01"},{"expected_detected":true,"sample_id":"soft_persona_drift_02"},{"expected_detected":true,"sample_id":"soft_persona_drift_03"},{"expected_detected":true,"sample_id":"soft_persona_drift_04"},{"expected_detected":true,"sample_id":"soft_persona_drift_05"},{"expected_detected":true,"sample_id":"soft_persona_drift_06"},{"expected_detected":false,"sample_id":"soft_persona_drift_07"},{"expected_detected":false,"sample_id":"soft_persona_drift_08"},{"expected_detected":false,"sample_id":"soft_persona_drift_09"},{"expected_detected":false,"sample_id":"soft_persona_drift_10"},{"expected_detected":false,"sample_id":"soft_persona_drift_11"},{"expected_detected":false,"sample_id":"soft_persona_drift_12"},{"expected_detected":true,"sample_id":"soft_persona_drift_13"},{"expected_detected":true,"sample_id":"soft_persona_drift_14"},{"expected_detected":true,"sample_id":"soft_persona_drift_15"},{"expected_detected":true,"sample_id":"soft_persona_drift_16"},{"expected_detected":true,"sample_id":"soft_persona_drift_17"},{"expected_detected":false,"sample_id":"soft_persona_drift_18"},{"expected_detected":false,"sample_id":"soft_persona_drift_19"},{"expected_detected":false,"sample_id":"soft_persona_drift_20"},{"expected_detected":false,"sample_id":"soft_persona_drift_21"},{"expected_detected":false,"sample_id":"soft_persona_drift_22"},{"expected_detected":true,"sample_id":"soft_persona_drift_23"},{"expected_detected":true,"sample_id":"soft_persona_drift_24"},{"expected_detected":true,"sample_id":"soft_persona_drift_25"},{"expected_detected":true,"sample_id":"soft_persona_drift_26"},{"expected_detected":false,"sample_id":"soft_persona_drift_27"},{"expected_detected":false,"sample_id":"soft_persona_drift_28"},{"expected_detected":false,"sample_id":"soft_persona_drift_29"},{"expected_detected":false,"sample_id":"soft_persona_drift_30"},{"expected_detected":true,"sample_id":"soft_trope_repeat_01"},{"expected_detected":true,"sample_id":"soft_trope_repeat_02"},{"expected_detected":true,"sample_id":"soft_trope_repeat_03"},{"expected_detected":true,"sample_id":"soft_trope_repeat_04"},{"expected_detected":true,"sample_id":"soft_trope_repeat_05"},{"expected_detected":true,"sample_id":"soft_trope_repeat_06"},{"expected_detected":false,"sample_id":"soft_trope_repeat_07"},{"expected_detected":false,"sample_id":"soft_trope_repeat_08"},{"expected_detected":false,"sample_id":"soft_trope_repeat_09"},{"expected_detected":false,"sample_id":"soft_trope_repeat_10"},{"expected_detected":false,"sample_id":"soft_trope_repeat_11"},{"expected_detected":false,"sample_id":"soft_trope_repeat_12"},{"expected_detected":true,"sample_id":"soft_trope_repeat_13"},{"expected_detected":true,"sample_id":"soft_trope_repeat_14"},{"expected_detected":true,"sample_id":"soft_trope_repeat_15"},{"expected_detected":true,"sample_id":"soft_trope_repeat_16"},{"expected_detected":true,"sample_id":"soft_trope_repeat_17"},{"expected_detected":false,"sample_id":"soft_trope_repeat_18"},{"expected_detected":false,"sample_id":"soft_trope_repeat_19"},{"expected_detected":false,"sample_id":"soft_trope_repeat_20"},{"expected_detected":false,"sample_id":"soft_trope_repeat_21"},{"expected_detected":false,"sample_id":"soft_trope_repeat_22"},{"expected_detected":true,"sample_id":"soft_trope_repeat_23"},{"expected_detected":true,"sample_id":"soft_trope_repeat_24"},{"expected_detected":true,"sample_id":"soft_trope_repeat_25"},{"expected_detected":true,"sample_id":"soft_trope_repeat_26"},{"expected_detected":false,"sample_id":"soft_trope_repeat_27"},{"expected_detected":false,"sample_id":"soft_trope_repeat_28"},{"expected_detected":false,"sample_id":"soft_trope_repeat_29"},{"expected_detected":false,"sample_id":"soft_trope_repeat_30"},{"expected_detected":true,"sample_id":"soft_word_count_cheat_01"},{"expected_detected":true,"sample_id":"soft_word_count_cheat_02"},{"expected_detected":true,"sample_id":"soft_word_count_cheat_03"},{"expected_detected":true,"sample_id":"soft_word_count_cheat_04"},{"expected_detected":true,"sample_id":"soft_word_count_cheat_05"},{"expected_detected":true,"sample_id":"soft_word_count_cheat_06"},{"expected_detected":false,"sample_id":"soft_word_count_cheat_07"},{"expected_detected":false,"sample_id":"soft_word_count_cheat_08"},{"expected_detected":false,"sample_id":"soft_word_count_cheat_09"},{"expected_detected":false,"sample_id":"soft_word_count_cheat_10"},{"expected_detected":false,"sample_id":"soft_word_count_cheat_11"},{"expected_detected":false,"sample_id":"soft_word_count_cheat_12"},{"expected_detected":true,"sample_id":"soft_word_count_cheat_13"},{"expected_detected":true,"sample_id":"soft_word_count_cheat_14"},{"expected_detected":true,"sample_id":"soft_word_count_cheat_15"},{"expected_detected":true,"sample_id":"soft_word_count_cheat_16"},{"expected_detected":true,"sample_id":"soft_word_count_cheat_17"},{"expected_detected":false,"sample_id":"soft_word_count_cheat_18"},{"expected_detected":false,"sample_id":"soft_word_count_cheat_19"},{"expected_detected":false,"sample_id":"soft_word_count_cheat_20"},{"expected_detected":false,"sample_id":"soft_word_count_cheat_21"},{"expected_detected":false,"sample_id":"soft_word_count_cheat_22"},{"expected_detected":true,"sample_id":"soft_word_count_cheat_23"},{"expected_detected":true,"sample_id":"soft_word_count_cheat_24"},{"expected_detected":true,"sample_id":"soft_word_count_cheat_25"},{"expected_detected":true,"sample_id":"soft_word_count_cheat_26"},{"expected_detected":false,"sample_id":"soft_word_count_cheat_27"},{"expected_detected":false,"sample_id":"soft_word_count_cheat_28"},{"expected_detected":false,"sample_id":"soft_word_count_cheat_29"},{"expected_detected":false,"sample_id":"soft_word_count_cheat_30"}],"labels_hash":"sha256:d8b334b898fd2b42392169da1ce450367e2a8b3a24d096e1964a529d9d969ce0","samples_hash":"sha256:99bf401f166aeee492eec7814c12446b365eacc62ac68a9b30f4329f5bce37b7","schema_version":"soft-corpus.labels.v1"}